{
  "$schema": "https://json-schema.org/draft/2020-12/schema",
  "title": "OpenPhenology search/1",
  "description": "Every searchable name, as [name, kind, species key]. May be split into shards.",
  "type": "object",
  "required": [
    "id",
    "kind",
    "format",
    "provenance",
    "data"
  ],
  "properties": {
    "id": {
      "description": "The file's path from the API root.",
      "type": "string",
      "pattern": "^releases/\\d{4}-\\d{2}-\\d{2}/search/index(/\\d+)?\\.json$"
    },
    "kind": {
      "description": "The format's name, such as `county-weekly`.",
      "const": "search"
    },
    "format": {
      "description": "Format name and version, for example `county-weekly/1.0`.",
      "type": "string",
      "pattern": "^search/1\\.\\d+$"
    },
    "provenance": {
      "description": "Where the content came from.",
      "type": "object",
      "required": [
        "release",
        "sources",
        "licences",
        "gbif_download_dois",
        "method",
        "taxonomy",
        "boundaries",
        "ranges",
        "protection",
        "code",
        "run"
      ],
      "properties": {
        "release": {
          "description": "The release the file belongs to, such as `2026-10-19`.",
          "type": "string",
          "pattern": "^\\d{4}-\\d{2}-\\d{2}$"
        },
        "sources": {
          "description": "Source IDs, as listed in `sources.json`.",
          "type": "array",
          "items": {
            "type": "string"
          }
        },
        "licences": {
          "description": "The licences of those sources.",
          "type": "array",
          "items": {
            "type": "string"
          }
        },
        "gbif_download_dois": {
          "description": "The GBIF downloads the records came from, as DOIs.",
          "type": "array",
          "items": {
            "type": "string"
          }
        },
        "method": {
          "description": "The method version, such as `seasonal-3`.",
          "anyOf": [
            {
              "type": "string"
            },
            {
              "type": "null"
            }
          ]
        },
        "taxonomy": {
          "description": "The taxonomy version species keys come from.",
          "anyOf": [
            {
              "type": "string"
            },
            {
              "type": "null"
            }
          ]
        },
        "boundaries": {
          "description": "The boundary version areas come from.",
          "anyOf": [
            {
              "type": "string"
            },
            {
              "type": "null"
            }
          ]
        },
        "ranges": {
          "description": "Each mapped range edition used.",
          "anyOf": [
            {
              "type": "array",
              "items": {
                "type": "string"
              }
            },
            {
              "type": "null"
            }
          ]
        },
        "protection": {
          "description": "The version of each sensitive-species list applied, by list.",
          "anyOf": [
            {
              "type": "object",
              "additionalProperties": {
                "type": "string"
              }
            },
            {
              "type": "null"
            }
          ]
        },
        "code": {
          "description": "The commit of the code that produced the file.",
          "anyOf": [
            {
              "type": "string"
            },
            {
              "type": "null"
            }
          ]
        },
        "run": {
          "description": "The run that produced the file.",
          "anyOf": [
            {
              "type": "string"
            },
            {
              "type": "null"
            }
          ]
        }
      }
    },
    "data": {
      "description": "The content, as the format sets out.",
      "type": "object",
      "required": [
        "names"
      ],
      "properties": {
        "names": {
          "description": "Every searchable name.",
          "type": "array",
          "items": {
            "type": "array",
            "prefixItems": [
              {
                "type": "string",
                "minLength": 1
              },
              {
                "enum": [
                  "scientific",
                  "common",
                  "synonym"
                ]
              },
              {
                "type": "string",
                "pattern": "^[A-Za-z0-9._-]+$"
              }
            ],
            "items": false,
            "minItems": 3
          }
        }
      }
    }
  }
}
